{
  "schema_id": "radi144_materialized_projection_table_ddl_implementation_decision_v1",
  "decision": "defer_ddl_implementation_until_alembic_revision_gate",
  "status": "ddl_implementation_decision_recorded_no_ddl",
  "ddl_implementation_decision_recorded": true,
  "planned_table": "module_projections",
  "ddl_implementation_enabled": false,
  "alembic_migration_enabled": false,
  "projection_storage_tables_enabled": false,
  "orm_model_enabled": false,
  "projection_write_service_enabled": false,
  "worker_projection_materialization_enabled": false,
  "required_future_gate": "radi144_materialized_projection_alembic_revision_gate_decision",
  "ddl_implementation_preconditions": [
    "table_contract_decision_recorded",
    "alembic_revision_id_reserved",
    "upgrade_downgrade_test_plan_defined",
    "sqlite_and_postgres_compatibility_reviewed",
    "partial_unique_index_strategy_reviewed",
    "json_column_type_strategy_reviewed",
    "foreign_key_ordering_reviewed",
    "orm_model_still_blocked",
    "write_service_still_blocked"
  ],
  "required_invariants": [
    "decision_only_no_database_table",
    "decision_only_no_alembic_revision",
    "decision_only_no_orm_model",
    "decision_only_no_write_service",
    "no_worker_projection_materialization",
    "api_read_projection_remains_on_demand",
    "stored_result_payload_remains_source_of_truth",
    "raw_debug_columns_forbidden",
    "safe_bundling_only_within_single_safety_boundary"
  ]
}
